No.     Time           Source                Destination           Protocol Length Info
      1 0.000000       host                  1.8.0                 USB      36     GET DESCRIPTOR Request DEVICE

Frame 1: Packet, 36 bytes on wire (288 bits), 36 bytes captured (288 bits) on interface \\.\USBPcap1, id 0
    Section number: 1
    Interface id: 0 (\\.\USBPcap1)
        Interface name: \\.\USBPcap1
        Interface description: USBPcap1
    Encapsulation type: USB packets with USBPcap header (152)
    Arrival Time: Apr 23, 2026 22:32:08.668592000 Hora de verano de Cuba
    UTC Arrival Time: Apr 24, 2026 02:32:08.668592000 UTC
    Epoch Arrival Time: 1776997928.668592000
    [Time shift for this packet: 0.000000000 seconds]
    [Time since reference or first frame: 0.000000000 seconds]
    Frame Number: 1
    Frame Length: 36 bytes (288 bits)
    Capture Length: 36 bytes (288 bits)
    [Frame is marked: False]
    [Frame is ignored: False]
    [Protocols in frame: usb]
    Character encoding: ASCII (0)
    [Coloring Rule Name: Nueva regla de coloreado]
    [Coloring Rule String: frame]
USB URB
    [Source: host]
    [Destination: 1.8.0]
    USBPcap pseudoheader length: 28
    IRP ID: 0x0000000000000000
    IRP USBD_STATUS: USBD_STATUS_SUCCESS (0x00000000)
    URB Function: URB_FUNCTION_GET_DESCRIPTOR_FROM_DEVICE (0x000b)
    IRP information: 0x00, Direction: FDO -> PDO
        0000 000. = Reserved: 0x00
        .... ...0 = Direction: FDO -> PDO (0x0)
    URB bus id: 1
    Device address: 8
    Endpoint: 0x80, Direction: IN
        1... .... = Direction: IN (1)
        .... 0000 = Endpoint number: 0
    URB transfer type: URB_CONTROL (0x02)
    Packet Data Length: 8
    [Response in: 2]
    Control transfer stage: Setup (0)
Setup Data
    bmRequestType: 0x80
        1... .... = Direction: Device-to-host
        .00. .... = Type: Standard (0x0)
        ...0 0000 = Recipient: Device (0x00)
    bRequest: GET DESCRIPTOR (6)
    Descriptor Index: 0x00
    bDescriptorType: DEVICE (0x01)
    Language Id: no language specified (0x0000)
    wLength: 18

No.     Time           Source                Destination           Protocol Length Info
      2 0.000000       1.8.0                 host                  USB      46     GET DESCRIPTOR Response DEVICE

Frame 2: Packet, 46 bytes on wire (368 bits), 46 bytes captured (368 bits) on interface \\.\USBPcap1, id 0
    Section number: 1
    Interface id: 0 (\\.\USBPcap1)
        Interface name: \\.\USBPcap1
        Interface description: USBPcap1
    Encapsulation type: USB packets with USBPcap header (152)
    Arrival Time: Apr 23, 2026 22:32:08.668592000 Hora de verano de Cuba
    UTC Arrival Time: Apr 24, 2026 02:32:08.668592000 UTC
    Epoch Arrival Time: 1776997928.668592000
    [Time shift for this packet: 0.000000000 seconds]
    [Time delta from previous captured frame: 0.000000000 seconds]
    [Time delta from previous displayed frame: 0.000000000 seconds]
    [Time since reference or first frame: 0.000000000 seconds]
    Frame Number: 2
    Frame Length: 46 bytes (368 bits)
    Capture Length: 46 bytes (368 bits)
    [Frame is marked: False]
    [Frame is ignored: False]
    [Protocols in frame: usb]
    Character encoding: ASCII (0)
    [Coloring Rule Name: Nueva regla de coloreado]
    [Coloring Rule String: frame]
USB URB
    [Source: 1.8.0]
    [Destination: host]
    USBPcap pseudoheader length: 28
    IRP ID: 0x0000000000000000
    IRP USBD_STATUS: USBD_STATUS_SUCCESS (0x00000000)
    URB Function: URB_FUNCTION_CONTROL_TRANSFER (0x0008)
    IRP information: 0x01, Direction: PDO -> FDO
        0000 000. = Reserved: 0x00
        .... ...1 = Direction: PDO -> FDO (0x1)
    URB bus id: 1
    Device address: 8
    Endpoint: 0x80, Direction: IN
        1... .... = Direction: IN (1)
        .... 0000 = Endpoint number: 0
    URB transfer type: URB_CONTROL (0x02)
    Packet Data Length: 18
    [Request in: 1]
    [Time from request: 0.000000000 seconds]
    Control transfer stage: Complete (3)
DEVICE DESCRIPTOR

No.     Time           Source                Destination           Protocol Length Info
      3 0.000000       host                  1.8.0                 USB      36     GET DESCRIPTOR Request CONFIGURATION

Frame 3: Packet, 36 bytes on wire (288 bits), 36 bytes captured (288 bits) on interface \\.\USBPcap1, id 0
    Section number: 1
    Interface id: 0 (\\.\USBPcap1)
        Interface name: \\.\USBPcap1
        Interface description: USBPcap1
    Encapsulation type: USB packets with USBPcap header (152)
    Arrival Time: Apr 23, 2026 22:32:08.668592000 Hora de verano de Cuba
    UTC Arrival Time: Apr 24, 2026 02:32:08.668592000 UTC
    Epoch Arrival Time: 1776997928.668592000
    [Time shift for this packet: 0.000000000 seconds]
    [Time delta from previous captured frame: 0.000000000 seconds]
    [Time delta from previous displayed frame: 0.000000000 seconds]
    [Time since reference or first frame: 0.000000000 seconds]
    Frame Number: 3
    Frame Length: 36 bytes (288 bits)
    Capture Length: 36 bytes (288 bits)
    [Frame is marked: False]
    [Frame is ignored: False]
    [Protocols in frame: usb]
    Character encoding: ASCII (0)
    [Coloring Rule Name: Nueva regla de coloreado]
    [Coloring Rule String: frame]
USB URB
    [Source: host]
    [Destination: 1.8.0]
    USBPcap pseudoheader length: 28
    IRP ID: 0x0000000000000000
    IRP USBD_STATUS: USBD_STATUS_SUCCESS (0x00000000)
    URB Function: URB_FUNCTION_GET_DESCRIPTOR_FROM_DEVICE (0x000b)
    IRP information: 0x00, Direction: FDO -> PDO
        0000 000. = Reserved: 0x00
        .... ...0 = Direction: FDO -> PDO (0x0)
    URB bus id: 1
    Device address: 8
    Endpoint: 0x80, Direction: IN
        1... .... = Direction: IN (1)
        .... 0000 = Endpoint number: 0
    URB transfer type: URB_CONTROL (0x02)
    Packet Data Length: 8
    [Response in: 4]
    Control transfer stage: Setup (0)
Setup Data
    bmRequestType: 0x80
        1... .... = Direction: Device-to-host
        .00. .... = Type: Standard (0x0)
        ...0 0000 = Recipient: Device (0x00)
    bRequest: GET DESCRIPTOR (6)
    Descriptor Index: 0x00
    bDescriptorType: CONFIGURATION (0x02)
    Language Id: no language specified (0x0000)
    wLength: 59

No.     Time           Source                Destination           Protocol Length Info
      4 0.000000       1.8.0                 host                  USB      87     GET DESCRIPTOR Response CONFIGURATION

Frame 4: Packet, 87 bytes on wire (696 bits), 87 bytes captured (696 bits) on interface \\.\USBPcap1, id 0
    Section number: 1
    Interface id: 0 (\\.\USBPcap1)
        Interface name: \\.\USBPcap1
        Interface description: USBPcap1
    Encapsulation type: USB packets with USBPcap header (152)
    Arrival Time: Apr 23, 2026 22:32:08.668592000 Hora de verano de Cuba
    UTC Arrival Time: Apr 24, 2026 02:32:08.668592000 UTC
    Epoch Arrival Time: 1776997928.668592000
    [Time shift for this packet: 0.000000000 seconds]
    [Time delta from previous captured frame: 0.000000000 seconds]
    [Time delta from previous displayed frame: 0.000000000 seconds]
    [Time since reference or first frame: 0.000000000 seconds]
    Frame Number: 4
    Frame Length: 87 bytes (696 bits)
    Capture Length: 87 bytes (696 bits)
    [Frame is marked: False]
    [Frame is ignored: False]
    [Protocols in frame: usb:usbhid:usbhid]
    Character encoding: ASCII (0)
    [Coloring Rule Name: Nueva regla de coloreado]
    [Coloring Rule String: frame]
USB URB
    [Source: 1.8.0]
    [Destination: host]
    USBPcap pseudoheader length: 28
    IRP ID: 0x0000000000000000
    IRP USBD_STATUS: USBD_STATUS_SUCCESS (0x00000000)
    URB Function: URB_FUNCTION_CONTROL_TRANSFER (0x0008)
    IRP information: 0x01, Direction: PDO -> FDO
        0000 000. = Reserved: 0x00
        .... ...1 = Direction: PDO -> FDO (0x1)
    URB bus id: 1
    Device address: 8
    Endpoint: 0x80, Direction: IN
        1... .... = Direction: IN (1)
        .... 0000 = Endpoint number: 0
    URB transfer type: URB_CONTROL (0x02)
    Packet Data Length: 59
    [Request in: 3]
    [Time from request: 0.000000000 seconds]
    Control transfer stage: Complete (3)
CONFIGURATION DESCRIPTOR
INTERFACE DESCRIPTOR (0.0): class HID
HID DESCRIPTOR
ENDPOINT DESCRIPTOR
INTERFACE DESCRIPTOR (1.0): class HID
HID DESCRIPTOR
ENDPOINT DESCRIPTOR

No.     Time           Source                Destination           Protocol Length Info
      5 0.000000       host                  1.8.0                 USB      36     SET CONFIGURATION Request

Frame 5: Packet, 36 bytes on wire (288 bits), 36 bytes captured (288 bits) on interface \\.\USBPcap1, id 0
    Section number: 1
    Interface id: 0 (\\.\USBPcap1)
        Interface name: \\.\USBPcap1
        Interface description: USBPcap1
    Encapsulation type: USB packets with USBPcap header (152)
    Arrival Time: Apr 23, 2026 22:32:08.668592000 Hora de verano de Cuba
    UTC Arrival Time: Apr 24, 2026 02:32:08.668592000 UTC
    Epoch Arrival Time: 1776997928.668592000
    [Time shift for this packet: 0.000000000 seconds]
    [Time delta from previous captured frame: 0.000000000 seconds]
    [Time delta from previous displayed frame: 0.000000000 seconds]
    [Time since reference or first frame: 0.000000000 seconds]
    Frame Number: 5
    Frame Length: 36 bytes (288 bits)
    Capture Length: 36 bytes (288 bits)
    [Frame is marked: False]
    [Frame is ignored: False]
    [Protocols in frame: usb]
    Character encoding: ASCII (0)
    [Coloring Rule Name: Nueva regla de coloreado]
    [Coloring Rule String: frame]
USB URB
    [Source: host]
    [Destination: 1.8.0]
    USBPcap pseudoheader length: 28
    IRP ID: 0x0000000000000000
    IRP USBD_STATUS: USBD_STATUS_SUCCESS (0x00000000)
    URB Function: URB_FUNCTION_SELECT_CONFIGURATION (0x0000)
    IRP information: 0x00, Direction: FDO -> PDO
        0000 000. = Reserved: 0x00
        .... ...0 = Direction: FDO -> PDO (0x0)
    URB bus id: 1
    Device address: 8
    Endpoint: 0x00, Direction: OUT
        0... .... = Direction: OUT (0)
        .... 0000 = Endpoint number: 0
    URB transfer type: URB_CONTROL (0x02)
    Packet Data Length: 8
    [Response in: 6]
    Control transfer stage: Setup (0)
Setup Data
    bmRequestType: 0x00
        0... .... = Direction: Host-to-device
        .00. .... = Type: Standard (0x0)
        ...0 0000 = Recipient: Device (0x00)
    bRequest: SET CONFIGURATION (9)
    bConfigurationValue: 1
    wIndex: 0 (0x0000)
    wLength: 0

No.     Time           Source                Destination           Protocol Length Info
      6 0.000000       1.8.0                 host                  USB      28     SET CONFIGURATION Response

Frame 6: Packet, 28 bytes on wire (224 bits), 28 bytes captured (224 bits) on interface \\.\USBPcap1, id 0
    Section number: 1
    Interface id: 0 (\\.\USBPcap1)
        Interface name: \\.\USBPcap1
        Interface description: USBPcap1
    Encapsulation type: USB packets with USBPcap header (152)
    Arrival Time: Apr 23, 2026 22:32:08.668592000 Hora de verano de Cuba
    UTC Arrival Time: Apr 24, 2026 02:32:08.668592000 UTC
    Epoch Arrival Time: 1776997928.668592000
    [Time shift for this packet: 0.000000000 seconds]
    [Time delta from previous captured frame: 0.000000000 seconds]
    [Time delta from previous displayed frame: 0.000000000 seconds]
    [Time since reference or first frame: 0.000000000 seconds]
    Frame Number: 6
    Frame Length: 28 bytes (224 bits)
    Capture Length: 28 bytes (224 bits)
    [Frame is marked: False]
    [Frame is ignored: False]
    [Protocols in frame: usb]
    Character encoding: ASCII (0)
    [Coloring Rule Name: Nueva regla de coloreado]
    [Coloring Rule String: frame]
USB URB
    [Source: 1.8.0]
    [Destination: host]
    USBPcap pseudoheader length: 28
    IRP ID: 0x0000000000000000
    IRP USBD_STATUS: USBD_STATUS_SUCCESS (0x00000000)
    URB Function: URB_FUNCTION_SELECT_CONFIGURATION (0x0000)
    IRP information: 0x01, Direction: PDO -> FDO
        0000 000. = Reserved: 0x00
        .... ...1 = Direction: PDO -> FDO (0x1)
    URB bus id: 1
    Device address: 8
    Endpoint: 0x00, Direction: OUT
        0... .... = Direction: OUT (0)
        .... 0000 = Endpoint number: 0
    URB transfer type: URB_CONTROL (0x02)
    Packet Data Length: 0
    [Request in: 5]
    [Time from request: 0.000000000 seconds]
    Control transfer stage: Complete (3)

No.     Time           Source                Destination           Protocol Length Info
      7 0.000000       host                  1.1.0                 USB      36     GET DESCRIPTOR Request DEVICE

Frame 7: Packet, 36 bytes on wire (288 bits), 36 bytes captured (288 bits) on interface \\.\USBPcap1, id 0
    Section number: 1
    Interface id: 0 (\\.\USBPcap1)
        Interface name: \\.\USBPcap1
        Interface description: USBPcap1
    Encapsulation type: USB packets with USBPcap header (152)
    Arrival Time: Apr 23, 2026 22:32:08.668592000 Hora de verano de Cuba
    UTC Arrival Time: Apr 24, 2026 02:32:08.668592000 UTC
    Epoch Arrival Time: 1776997928.668592000
    [Time shift for this packet: 0.000000000 seconds]
    [Time delta from previous captured frame: 0.000000000 seconds]
    [Time delta from previous displayed frame: 0.000000000 seconds]
    [Time since reference or first frame: 0.000000000 seconds]
    Frame Number: 7
    Frame Length: 36 bytes (288 bits)
    Capture Length: 36 bytes (288 bits)
    [Frame is marked: False]
    [Frame is ignored: False]
    [Protocols in frame: usb]
    Character encoding: ASCII (0)
    [Coloring Rule Name: Nueva regla de coloreado]
    [Coloring Rule String: frame]
USB URB
    [Source: host]
    [Destination: 1.1.0]
    USBPcap pseudoheader length: 28
    IRP ID: 0x0000000000000000
    IRP USBD_STATUS: USBD_STATUS_SUCCESS (0x00000000)
    URB Function: URB_FUNCTION_GET_DESCRIPTOR_FROM_DEVICE (0x000b)
    IRP information: 0x00, Direction: FDO -> PDO
        0000 000. = Reserved: 0x00
        .... ...0 = Direction: FDO -> PDO (0x0)
    URB bus id: 1
    Device address: 1
    Endpoint: 0x80, Direction: IN
        1... .... = Direction: IN (1)
        .... 0000 = Endpoint number: 0
    URB transfer type: URB_CONTROL (0x02)
    Packet Data Length: 8
    [Response in: 8]
    Control transfer stage: Setup (0)
Setup Data
    bmRequestType: 0x80
        1... .... = Direction: Device-to-host
        .00. .... = Type: Standard (0x0)
        ...0 0000 = Recipient: Device (0x00)
    bRequest: GET DESCRIPTOR (6)
    Descriptor Index: 0x00
    bDescriptorType: DEVICE (0x01)
    Language Id: no language specified (0x0000)
    wLength: 18

No.     Time           Source                Destination           Protocol Length Info
      8 0.000000       1.1.0                 host                  USB      46     GET DESCRIPTOR Response DEVICE

Frame 8: Packet, 46 bytes on wire (368 bits), 46 bytes captured (368 bits) on interface \\.\USBPcap1, id 0
    Section number: 1
    Interface id: 0 (\\.\USBPcap1)
        Interface name: \\.\USBPcap1
        Interface description: USBPcap1
    Encapsulation type: USB packets with USBPcap header (152)
    Arrival Time: Apr 23, 2026 22:32:08.668592000 Hora de verano de Cuba
    UTC Arrival Time: Apr 24, 2026 02:32:08.668592000 UTC
    Epoch Arrival Time: 1776997928.668592000
    [Time shift for this packet: 0.000000000 seconds]
    [Time delta from previous captured frame: 0.000000000 seconds]
    [Time delta from previous displayed frame: 0.000000000 seconds]
    [Time since reference or first frame: 0.000000000 seconds]
    Frame Number: 8
    Frame Length: 46 bytes (368 bits)
    Capture Length: 46 bytes (368 bits)
    [Frame is marked: False]
    [Frame is ignored: False]
    [Protocols in frame: usb]
    Character encoding: ASCII (0)
    [Coloring Rule Name: Nueva regla de coloreado]
    [Coloring Rule String: frame]
USB URB
    [Source: 1.1.0]
    [Destination: host]
    USBPcap pseudoheader length: 28
    IRP ID: 0x0000000000000000
    IRP USBD_STATUS: USBD_STATUS_SUCCESS (0x00000000)
    URB Function: URB_FUNCTION_CONTROL_TRANSFER (0x0008)
    IRP information: 0x01, Direction: PDO -> FDO
        0000 000. = Reserved: 0x00
        .... ...1 = Direction: PDO -> FDO (0x1)
    URB bus id: 1
    Device address: 1
    Endpoint: 0x80, Direction: IN
        1... .... = Direction: IN (1)
        .... 0000 = Endpoint number: 0
    URB transfer type: URB_CONTROL (0x02)
    Packet Data Length: 18
    [Request in: 7]
    [Time from request: 0.000000000 seconds]
    Control transfer stage: Complete (3)
DEVICE DESCRIPTOR

No.     Time           Source                Destination           Protocol Length Info
      9 0.000000       host                  1.1.0                 USB      36     GET DESCRIPTOR Request CONFIGURATION

Frame 9: Packet, 36 bytes on wire (288 bits), 36 bytes captured (288 bits) on interface \\.\USBPcap1, id 0
    Section number: 1
    Interface id: 0 (\\.\USBPcap1)
        Interface name: \\.\USBPcap1
        Interface description: USBPcap1
    Encapsulation type: USB packets with USBPcap header (152)
    Arrival Time: Apr 23, 2026 22:32:08.668592000 Hora de verano de Cuba
    UTC Arrival Time: Apr 24, 2026 02:32:08.668592000 UTC
    Epoch Arrival Time: 1776997928.668592000
    [Time shift for this packet: 0.000000000 seconds]
    [Time delta from previous captured frame: 0.000000000 seconds]
    [Time delta from previous displayed frame: 0.000000000 seconds]
    [Time since reference or first frame: 0.000000000 seconds]
    Frame Number: 9
    Frame Length: 36 bytes (288 bits)
    Capture Length: 36 bytes (288 bits)
    [Frame is marked: False]
    [Frame is ignored: False]
    [Protocols in frame: usb]
    Character encoding: ASCII (0)
    [Coloring Rule Name: Nueva regla de coloreado]
    [Coloring Rule String: frame]
USB URB
    [Source: host]
    [Destination: 1.1.0]
    USBPcap pseudoheader length: 28
    IRP ID: 0x0000000000000000
    IRP USBD_STATUS: USBD_STATUS_SUCCESS (0x00000000)
    URB Function: URB_FUNCTION_GET_DESCRIPTOR_FROM_DEVICE (0x000b)
    IRP information: 0x00, Direction: FDO -> PDO
        0000 000. = Reserved: 0x00
        .... ...0 = Direction: FDO -> PDO (0x0)
    URB bus id: 1
    Device address: 1
    Endpoint: 0x80, Direction: IN
        1... .... = Direction: IN (1)
        .... 0000 = Endpoint number: 0
    URB transfer type: URB_CONTROL (0x02)
    Packet Data Length: 8
    [Response in: 10]
    Control transfer stage: Setup (0)
Setup Data
    bmRequestType: 0x80
        1... .... = Direction: Device-to-host
        .00. .... = Type: Standard (0x0)
        ...0 0000 = Recipient: Device (0x00)
    bRequest: GET DESCRIPTOR (6)
    Descriptor Index: 0x00
    bDescriptorType: CONFIGURATION (0x02)
    Language Id: no language specified (0x0000)
    wLength: 1026

No.     Time           Source                Destination           Protocol Length Info
     10 0.000000       1.1.0                 host                  USB      1054   GET DESCRIPTOR Response CONFIGURATION

Frame 10: Packet, 1054 bytes on wire (8432 bits), 1054 bytes captured (8432 bits) on interface \\.\USBPcap1, id 0
    Section number: 1
    Interface id: 0 (\\.\USBPcap1)
        Interface name: \\.\USBPcap1
        Interface description: USBPcap1
    Encapsulation type: USB packets with USBPcap header (152)
    Arrival Time: Apr 23, 2026 22:32:08.668592000 Hora de verano de Cuba
    UTC Arrival Time: Apr 24, 2026 02:32:08.668592000 UTC
    Epoch Arrival Time: 1776997928.668592000
    [Time shift for this packet: 0.000000000 seconds]
    [Time delta from previous captured frame: 0.000000000 seconds]
    [Time delta from previous displayed frame: 0.000000000 seconds]
    [Time since reference or first frame: 0.000000000 seconds]
    Frame Number: 10
    Frame Length: 1054 bytes (8432 bits)
    Capture Length: 1054 bytes (8432 bits)
    [Frame is marked: False]
    [Frame is ignored: False]
    [Protocols in frame […]: usb:usbvideo:usbvideo:usbvideo:usbvideo:usbvideo:usbvideo:usbvideo:usbvideo:usbvideo:usbvideo:usbvideo:usbvideo:usbvideo:usbvideo:usbvideo:usbvideo:usbvideo:usbvideo:usbvideo:usbvideo:usbvideo:usbvideo:usbvideo:us]
    Character encoding: ASCII (0)
    [Coloring Rule Name: Nueva regla de coloreado]
    [Coloring Rule String: frame]
USB URB
    [Source: 1.1.0]
    [Destination: host]
    USBPcap pseudoheader length: 28
    IRP ID: 0x0000000000000000
    IRP USBD_STATUS: USBD_STATUS_SUCCESS (0x00000000)
    URB Function: URB_FUNCTION_CONTROL_TRANSFER (0x0008)
    IRP information: 0x01, Direction: PDO -> FDO
        0000 000. = Reserved: 0x00
        .... ...1 = Direction: PDO -> FDO (0x1)
    URB bus id: 1
    Device address: 1
    Endpoint: 0x80, Direction: IN
        1... .... = Direction: IN (1)
        .... 0000 = Endpoint number: 0
    URB transfer type: URB_CONTROL (0x02)
    Packet Data Length: 1026
    [Request in: 9]
    [Time from request: 0.000000000 seconds]
    Control transfer stage: Complete (3)
CONFIGURATION DESCRIPTOR
INTERFACE ASSOCIATION DESCRIPTOR
INTERFACE DESCRIPTOR (0.0): class Video
VIDEO CONTROL INTERFACE DESCRIPTOR [Header]
VIDEO CONTROL INTERFACE DESCRIPTOR [Input Terminal] (Entity 1)
VIDEO CONTROL INTERFACE DESCRIPTOR [Processing Unit] (Entity 2)
VIDEO CONTROL INTERFACE DESCRIPTOR [Extension Unit] (Entity 3)
VIDEO CONTROL INTERFACE DESCRIPTOR [Extension Unit] (Entity 4)
VIDEO CONTROL INTERFACE DESCRIPTOR [Output Terminal] (Entity 5)
ENDPOINT DESCRIPTOR
VIDEO CONTROL ENDPOINT DESCRIPTOR [Interrupt]
INTERFACE DESCRIPTOR (1.0): class Video
VIDEO STREAMING INTERFACE DESCRIPTOR [Input Header]
VIDEO STREAMING INTERFACE DESCRIPTOR [Format MJPEG]  (Format 1)
VIDEO STREAMING INTERFACE DESCRIPTOR [Frame MJPEG]   (Index  1): 1280 x  720
VIDEO STREAMING INTERFACE DESCRIPTOR [Frame MJPEG]   (Index  2):  320 x  180
VIDEO STREAMING INTERFACE DESCRIPTOR [Frame MJPEG]   (Index  3):  320 x  240
VIDEO STREAMING INTERFACE DESCRIPTOR [Frame MJPEG]   (Index  4):  352 x  288
VIDEO STREAMING INTERFACE DESCRIPTOR [Frame MJPEG]   (Index  5):  424 x  240
VIDEO STREAMING INTERFACE DESCRIPTOR [Frame MJPEG]   (Index  6):  640 x  360
VIDEO STREAMING INTERFACE DESCRIPTOR [Frame MJPEG]   (Index  7):  640 x  480
VIDEO STREAMING INTERFACE DESCRIPTOR [Frame MJPEG]   (Index  8):  848 x  480
VIDEO STREAMING INTERFACE DESCRIPTOR [Frame MJPEG]   (Index  9):  960 x  540
VIDEO STREAMING INTERFACE DESCRIPTOR [Still Image Frame]
VIDEO STREAMING INTERFACE DESCRIPTOR [Colorformat]
VIDEO STREAMING INTERFACE DESCRIPTOR [Format Uncompressed]  (Format 2): YUY2
VIDEO STREAMING INTERFACE DESCRIPTOR [Frame Uncompressed]   (Index  1): 1280 x  720
VIDEO STREAMING INTERFACE DESCRIPTOR [Frame Uncompressed]   (Index  2):  320 x  180
VIDEO STREAMING INTERFACE DESCRIPTOR [Frame Uncompressed]   (Index  3):  320 x  240
VIDEO STREAMING INTERFACE DESCRIPTOR [Frame Uncompressed]   (Index  4):  352 x  288
VIDEO STREAMING INTERFACE DESCRIPTOR [Frame Uncompressed]   (Index  5):  424 x  240
VIDEO STREAMING INTERFACE DESCRIPTOR [Frame Uncompressed]   (Index  6):  640 x  360
VIDEO STREAMING INTERFACE DESCRIPTOR [Frame Uncompressed]   (Index  7):  640 x  480
VIDEO STREAMING INTERFACE DESCRIPTOR [Frame Uncompressed]   (Index  8):  848 x  480
VIDEO STREAMING INTERFACE DESCRIPTOR [Frame Uncompressed]   (Index  9):  960 x  540
VIDEO STREAMING INTERFACE DESCRIPTOR [Still Image Frame]
VIDEO STREAMING INTERFACE DESCRIPTOR [Colorformat]
INTERFACE DESCRIPTOR (1.1): class Video
ENDPOINT DESCRIPTOR
INTERFACE DESCRIPTOR (1.2): class Video
ENDPOINT DESCRIPTOR
INTERFACE DESCRIPTOR (1.3): class Video
ENDPOINT DESCRIPTOR
INTERFACE DESCRIPTOR (1.4): class Video
ENDPOINT DESCRIPTOR
INTERFACE DESCRIPTOR (1.5): class Video
ENDPOINT DESCRIPTOR
INTERFACE DESCRIPTOR (1.6): class Video
ENDPOINT DESCRIPTOR
INTERFACE DESCRIPTOR (1.7): class Video
ENDPOINT DESCRIPTOR
INTERFACE DESCRIPTOR (1.8): class Video
ENDPOINT DESCRIPTOR
INTERFACE DESCRIPTOR (1.9): class Video
ENDPOINT DESCRIPTOR
INTERFACE DESCRIPTOR (1.10): class Video
ENDPOINT DESCRIPTOR
INTERFACE DESCRIPTOR (1.11): class Video
ENDPOINT DESCRIPTOR

No.     Time           Source                Destination           Protocol Length Info
     11 0.000000       host                  1.1.0                 USB      36     SET CONFIGURATION Request

Frame 11: Packet, 36 bytes on wire (288 bits), 36 bytes captured (288 bits) on interface \\.\USBPcap1, id 0
    Section number: 1
    Interface id: 0 (\\.\USBPcap1)
        Interface name: \\.\USBPcap1
        Interface description: USBPcap1
    Encapsulation type: USB packets with USBPcap header (152)
    Arrival Time: Apr 23, 2026 22:32:08.668592000 Hora de verano de Cuba
    UTC Arrival Time: Apr 24, 2026 02:32:08.668592000 UTC
    Epoch Arrival Time: 1776997928.668592000
    [Time shift for this packet: 0.000000000 seconds]
    [Time delta from previous captured frame: 0.000000000 seconds]
    [Time delta from previous displayed frame: 0.000000000 seconds]
    [Time since reference or first frame: 0.000000000 seconds]
    Frame Number: 11
    Frame Length: 36 bytes (288 bits)
    Capture Length: 36 bytes (288 bits)
    [Frame is marked: False]
    [Frame is ignored: False]
    [Protocols in frame: usb]
    Character encoding: ASCII (0)
    [Coloring Rule Name: Nueva regla de coloreado]
    [Coloring Rule String: frame]
USB URB
    [Source: host]
    [Destination: 1.1.0]
    USBPcap pseudoheader length: 28
    IRP ID: 0x0000000000000000
    IRP USBD_STATUS: USBD_STATUS_SUCCESS (0x00000000)
    URB Function: URB_FUNCTION_SELECT_CONFIGURATION (0x0000)
    IRP information: 0x00, Direction: FDO -> PDO
        0000 000. = Reserved: 0x00
        .... ...0 = Direction: FDO -> PDO (0x0)
    URB bus id: 1
    Device address: 1
    Endpoint: 0x00, Direction: OUT
        0... .... = Direction: OUT (0)
        .... 0000 = Endpoint number: 0
    URB transfer type: URB_CONTROL (0x02)
    Packet Data Length: 8
    [Response in: 12]
    Control transfer stage: Setup (0)
Setup Data
    bmRequestType: 0x00
        0... .... = Direction: Host-to-device
        .00. .... = Type: Standard (0x0)
        ...0 0000 = Recipient: Device (0x00)
    bRequest: SET CONFIGURATION (9)
    bConfigurationValue: 1
    wIndex: 0 (0x0000)
    wLength: 0

No.     Time           Source                Destination           Protocol Length Info
     12 0.000000       1.1.0                 host                  USB      28     SET CONFIGURATION Response

Frame 12: Packet, 28 bytes on wire (224 bits), 28 bytes captured (224 bits) on interface \\.\USBPcap1, id 0
    Section number: 1
    Interface id: 0 (\\.\USBPcap1)
        Interface name: \\.\USBPcap1
        Interface description: USBPcap1
    Encapsulation type: USB packets with USBPcap header (152)
    Arrival Time: Apr 23, 2026 22:32:08.668592000 Hora de verano de Cuba
    UTC Arrival Time: Apr 24, 2026 02:32:08.668592000 UTC
    Epoch Arrival Time: 1776997928.668592000
    [Time shift for this packet: 0.000000000 seconds]
    [Time delta from previous captured frame: 0.000000000 seconds]
    [Time delta from previous displayed frame: 0.000000000 seconds]
    [Time since reference or first frame: 0.000000000 seconds]
    Frame Number: 12
    Frame Length: 28 bytes (224 bits)
    Capture Length: 28 bytes (224 bits)
    [Frame is marked: False]
    [Frame is ignored: False]
    [Protocols in frame: usb]
    Character encoding: ASCII (0)
    [Coloring Rule Name: Nueva regla de coloreado]
    [Coloring Rule String: frame]
USB URB
    [Source: 1.1.0]
    [Destination: host]
    USBPcap pseudoheader length: 28
    IRP ID: 0x0000000000000000
    IRP USBD_STATUS: USBD_STATUS_SUCCESS (0x00000000)
    URB Function: URB_FUNCTION_SELECT_CONFIGURATION (0x0000)
    IRP information: 0x01, Direction: PDO -> FDO
        0000 000. = Reserved: 0x00
        .... ...1 = Direction: PDO -> FDO (0x1)
    URB bus id: 1
    Device address: 1
    Endpoint: 0x00, Direction: OUT
        0... .... = Direction: OUT (0)
        .... 0000 = Endpoint number: 0
    URB transfer type: URB_CONTROL (0x02)
    Packet Data Length: 0
    [Request in: 11]
    [Time from request: 0.000000000 seconds]
    Control transfer stage: Complete (3)

No.     Time           Source                Destination           Protocol Length Info
     13 0.000000       host                  1.2.0                 USB      36     GET DESCRIPTOR Request DEVICE

Frame 13: Packet, 36 bytes on wire (288 bits), 36 bytes captured (288 bits) on interface \\.\USBPcap1, id 0
    Section number: 1
    Interface id: 0 (\\.\USBPcap1)
        Interface name: \\.\USBPcap1
        Interface description: USBPcap1
    Encapsulation type: USB packets with USBPcap header (152)
    Arrival Time: Apr 23, 2026 22:32:08.668592000 Hora de verano de Cuba
    UTC Arrival Time: Apr 24, 2026 02:32:08.668592000 UTC
    Epoch Arrival Time: 1776997928.668592000
    [Time shift for this packet: 0.000000000 seconds]
    [Time delta from previous captured frame: 0.000000000 seconds]
    [Time delta from previous displayed frame: 0.000000000 seconds]
    [Time since reference or first frame: 0.000000000 seconds]
    Frame Number: 13
    Frame Length: 36 bytes (288 bits)
    Capture Length: 36 bytes (288 bits)
    [Frame is marked: False]
    [Frame is ignored: False]
    [Protocols in frame: usb]
    Character encoding: ASCII (0)
    [Coloring Rule Name: Nueva regla de coloreado]
    [Coloring Rule String: frame]
USB URB
    [Source: host]
    [Destination: 1.2.0]
    USBPcap pseudoheader length: 28
    IRP ID: 0x0000000000000000
    IRP USBD_STATUS: USBD_STATUS_SUCCESS (0x00000000)
    URB Function: URB_FUNCTION_GET_DESCRIPTOR_FROM_DEVICE (0x000b)
    IRP information: 0x00, Direction: FDO -> PDO
        0000 000. = Reserved: 0x00
        .... ...0 = Direction: FDO -> PDO (0x0)
    URB bus id: 1
    Device address: 2
    Endpoint: 0x80, Direction: IN
        1... .... = Direction: IN (1)
        .... 0000 = Endpoint number: 0
    URB transfer type: URB_CONTROL (0x02)
    Packet Data Length: 8
    [Response in: 14]
    Control transfer stage: Setup (0)
Setup Data
    bmRequestType: 0x80
        1... .... = Direction: Device-to-host
        .00. .... = Type: Standard (0x0)
        ...0 0000 = Recipient: Device (0x00)
    bRequest: GET DESCRIPTOR (6)
    Descriptor Index: 0x00
    bDescriptorType: DEVICE (0x01)
    Language Id: no language specified (0x0000)
    wLength: 18

No.     Time           Source                Destination           Protocol Length Info
     14 0.000000       1.2.0                 host                  USB      46     GET DESCRIPTOR Response DEVICE

Frame 14: Packet, 46 bytes on wire (368 bits), 46 bytes captured (368 bits) on interface \\.\USBPcap1, id 0
    Section number: 1
    Interface id: 0 (\\.\USBPcap1)
        Interface name: \\.\USBPcap1
        Interface description: USBPcap1
    Encapsulation type: USB packets with USBPcap header (152)
    Arrival Time: Apr 23, 2026 22:32:08.668592000 Hora de verano de Cuba
    UTC Arrival Time: Apr 24, 2026 02:32:08.668592000 UTC
    Epoch Arrival Time: 1776997928.668592000
    [Time shift for this packet: 0.000000000 seconds]
    [Time delta from previous captured frame: 0.000000000 seconds]
    [Time delta from previous displayed frame: 0.000000000 seconds]
    [Time since reference or first frame: 0.000000000 seconds]
    Frame Number: 14
    Frame Length: 46 bytes (368 bits)
    Capture Length: 46 bytes (368 bits)
    [Frame is marked: False]
    [Frame is ignored: False]
    [Protocols in frame: usb]
    Character encoding: ASCII (0)
    [Coloring Rule Name: Nueva regla de coloreado]
    [Coloring Rule String: frame]
USB URB
    [Source: 1.2.0]
    [Destination: host]
    USBPcap pseudoheader length: 28
    IRP ID: 0x0000000000000000
    IRP USBD_STATUS: USBD_STATUS_SUCCESS (0x00000000)
    URB Function: URB_FUNCTION_CONTROL_TRANSFER (0x0008)
    IRP information: 0x01, Direction: PDO -> FDO
        0000 000. = Reserved: 0x00
        .... ...1 = Direction: PDO -> FDO (0x1)
    URB bus id: 1
    Device address: 2
    Endpoint: 0x80, Direction: IN
        1... .... = Direction: IN (1)
        .... 0000 = Endpoint number: 0
    URB transfer type: URB_CONTROL (0x02)
    Packet Data Length: 18
    [Request in: 13]
    [Time from request: 0.000000000 seconds]
    Control transfer stage: Complete (3)
DEVICE DESCRIPTOR

No.     Time           Source                Destination           Protocol Length Info
     15 0.000000       host                  1.2.0                 USB      36     GET DESCRIPTOR Request CONFIGURATION

Frame 15: Packet, 36 bytes on wire (288 bits), 36 bytes captured (288 bits) on interface \\.\USBPcap1, id 0
    Section number: 1
    Interface id: 0 (\\.\USBPcap1)
        Interface name: \\.\USBPcap1
        Interface description: USBPcap1
    Encapsulation type: USB packets with USBPcap header (152)
    Arrival Time: Apr 23, 2026 22:32:08.668592000 Hora de verano de Cuba
    UTC Arrival Time: Apr 24, 2026 02:32:08.668592000 UTC
    Epoch Arrival Time: 1776997928.668592000
    [Time shift for this packet: 0.000000000 seconds]
    [Time delta from previous captured frame: 0.000000000 seconds]
    [Time delta from previous displayed frame: 0.000000000 seconds]
    [Time since reference or first frame: 0.000000000 seconds]
    Frame Number: 15
    Frame Length: 36 bytes (288 bits)
    Capture Length: 36 bytes (288 bits)
    [Frame is marked: False]
    [Frame is ignored: False]
    [Protocols in frame: usb]
    Character encoding: ASCII (0)
    [Coloring Rule Name: Nueva regla de coloreado]
    [Coloring Rule String: frame]
USB URB
    [Source: host]
    [Destination: 1.2.0]
    USBPcap pseudoheader length: 28
    IRP ID: 0x0000000000000000
    IRP USBD_STATUS: USBD_STATUS_SUCCESS (0x00000000)
    URB Function: URB_FUNCTION_GET_DESCRIPTOR_FROM_DEVICE (0x000b)
    IRP information: 0x00, Direction: FDO -> PDO
        0000 000. = Reserved: 0x00
        .... ...0 = Direction: FDO -> PDO (0x0)
    URB bus id: 1
    Device address: 2
    Endpoint: 0x80, Direction: IN
        1... .... = Direction: IN (1)
        .... 0000 = Endpoint number: 0
    URB transfer type: URB_CONTROL (0x02)
    Packet Data Length: 8
    [Response in: 16]
    Control transfer stage: Setup (0)
Setup Data
    bmRequestType: 0x80
        1... .... = Direction: Device-to-host
        .00. .... = Type: Standard (0x0)
        ...0 0000 = Recipient: Device (0x00)
    bRequest: GET DESCRIPTOR (6)
    Descriptor Index: 0x00
    bDescriptorType: CONFIGURATION (0x02)
    Language Id: no language specified (0x0000)
    wLength: 200

No.     Time           Source                Destination           Protocol Length Info
     16 0.000000       1.2.0                 host                  USB      228    GET DESCRIPTOR Response CONFIGURATION

Frame 16: Packet, 228 bytes on wire (1824 bits), 228 bytes captured (1824 bits) on interface \\.\USBPcap1, id 0
    Section number: 1
    Interface id: 0 (\\.\USBPcap1)
        Interface name: \\.\USBPcap1
        Interface description: USBPcap1
    Encapsulation type: USB packets with USBPcap header (152)
    Arrival Time: Apr 23, 2026 22:32:08.668592000 Hora de verano de Cuba
    UTC Arrival Time: Apr 24, 2026 02:32:08.668592000 UTC
    Epoch Arrival Time: 1776997928.668592000
    [Time shift for this packet: 0.000000000 seconds]
    [Time delta from previous captured frame: 0.000000000 seconds]
    [Time delta from previous displayed frame: 0.000000000 seconds]
    [Time since reference or first frame: 0.000000000 seconds]
    Frame Number: 16
    Frame Length: 228 bytes (1824 bits)
    Capture Length: 228 bytes (1824 bits)
    [Frame is marked: False]
    [Frame is ignored: False]
    [Protocols in frame: usb]
    Character encoding: ASCII (0)
    [Coloring Rule Name: Nueva regla de coloreado]
    [Coloring Rule String: frame]
USB URB
    [Source: 1.2.0]
    [Destination: host]
    USBPcap pseudoheader length: 28
    IRP ID: 0x0000000000000000
    IRP USBD_STATUS: USBD_STATUS_SUCCESS (0x00000000)
    URB Function: URB_FUNCTION_CONTROL_TRANSFER (0x0008)
    IRP information: 0x01, Direction: PDO -> FDO
        0000 000. = Reserved: 0x00
        .... ...1 = Direction: PDO -> FDO (0x1)
    URB bus id: 1
    Device address: 2
    Endpoint: 0x80, Direction: IN
        1... .... = Direction: IN (1)
        .... 0000 = Endpoint number: 0
    URB transfer type: URB_CONTROL (0x02)
    Packet Data Length: 200
    [Request in: 15]
    [Time from request: 0.000000000 seconds]
    Control transfer stage: Complete (3)
CONFIGURATION DESCRIPTOR
INTERFACE DESCRIPTOR (0.0): class Wireless Controller
ENDPOINT DESCRIPTOR
ENDPOINT DESCRIPTOR
ENDPOINT DESCRIPTOR
INTERFACE DESCRIPTOR (1.0): class Wireless Controller
ENDPOINT DESCRIPTOR
ENDPOINT DESCRIPTOR
INTERFACE DESCRIPTOR (1.1): class Wireless Controller
ENDPOINT DESCRIPTOR
ENDPOINT DESCRIPTOR
INTERFACE DESCRIPTOR (1.2): class Wireless Controller
ENDPOINT DESCRIPTOR
ENDPOINT DESCRIPTOR
INTERFACE DESCRIPTOR (1.3): class Wireless Controller
ENDPOINT DESCRIPTOR
ENDPOINT DESCRIPTOR
INTERFACE DESCRIPTOR (1.4): class Wireless Controller
ENDPOINT DESCRIPTOR
ENDPOINT DESCRIPTOR
INTERFACE DESCRIPTOR (1.5): class Wireless Controller
ENDPOINT DESCRIPTOR
ENDPOINT DESCRIPTOR
INTERFACE DESCRIPTOR (1.6): class Wireless Controller
ENDPOINT DESCRIPTOR
ENDPOINT DESCRIPTOR

No.     Time           Source                Destination           Protocol Length Info
     17 0.000000       host                  1.2.0                 USB      36     SET CONFIGURATION Request

Frame 17: Packet, 36 bytes on wire (288 bits), 36 bytes captured (288 bits) on interface \\.\USBPcap1, id 0
    Section number: 1
    Interface id: 0 (\\.\USBPcap1)
        Interface name: \\.\USBPcap1
        Interface description: USBPcap1
    Encapsulation type: USB packets with USBPcap header (152)
    Arrival Time: Apr 23, 2026 22:32:08.668592000 Hora de verano de Cuba
    UTC Arrival Time: Apr 24, 2026 02:32:08.668592000 UTC
    Epoch Arrival Time: 1776997928.668592000
    [Time shift for this packet: 0.000000000 seconds]
    [Time delta from previous captured frame: 0.000000000 seconds]
    [Time delta from previous displayed frame: 0.000000000 seconds]
    [Time since reference or first frame: 0.000000000 seconds]
    Frame Number: 17
    Frame Length: 36 bytes (288 bits)
    Capture Length: 36 bytes (288 bits)
    [Frame is marked: False]
    [Frame is ignored: False]
    [Protocols in frame: usb]
    Character encoding: ASCII (0)
    [Coloring Rule Name: Nueva regla de coloreado]
    [Coloring Rule String: frame]
USB URB
    [Source: host]
    [Destination: 1.2.0]
    USBPcap pseudoheader length: 28
    IRP ID: 0x0000000000000000
    IRP USBD_STATUS: USBD_STATUS_SUCCESS (0x00000000)
    URB Function: URB_FUNCTION_SELECT_CONFIGURATION (0x0000)
    IRP information: 0x00, Direction: FDO -> PDO
        0000 000. = Reserved: 0x00
        .... ...0 = Direction: FDO -> PDO (0x0)
    URB bus id: 1
    Device address: 2
    Endpoint: 0x00, Direction: OUT
        0... .... = Direction: OUT (0)
        .... 0000 = Endpoint number: 0
    URB transfer type: URB_CONTROL (0x02)
    Packet Data Length: 8
    [Response in: 18]
    Control transfer stage: Setup (0)
Setup Data
    bmRequestType: 0x00
        0... .... = Direction: Host-to-device
        .00. .... = Type: Standard (0x0)
        ...0 0000 = Recipient: Device (0x00)
    bRequest: SET CONFIGURATION (9)
    bConfigurationValue: 1
    wIndex: 0 (0x0000)
    wLength: 0

No.     Time           Source                Destination           Protocol Length Info
     18 0.000000       1.2.0                 host                  USB      28     SET CONFIGURATION Response

Frame 18: Packet, 28 bytes on wire (224 bits), 28 bytes captured (224 bits) on interface \\.\USBPcap1, id 0
    Section number: 1
    Interface id: 0 (\\.\USBPcap1)
        Interface name: \\.\USBPcap1
        Interface description: USBPcap1
    Encapsulation type: USB packets with USBPcap header (152)
    Arrival Time: Apr 23, 2026 22:32:08.668592000 Hora de verano de Cuba
    UTC Arrival Time: Apr 24, 2026 02:32:08.668592000 UTC
    Epoch Arrival Time: 1776997928.668592000
    [Time shift for this packet: 0.000000000 seconds]
    [Time delta from previous captured frame: 0.000000000 seconds]
    [Time delta from previous displayed frame: 0.000000000 seconds]
    [Time since reference or first frame: 0.000000000 seconds]
    Frame Number: 18
    Frame Length: 28 bytes (224 bits)
    Capture Length: 28 bytes (224 bits)
    [Frame is marked: False]
    [Frame is ignored: False]
    [Protocols in frame: usb]
    Character encoding: ASCII (0)
    [Coloring Rule Name: Nueva regla de coloreado]
    [Coloring Rule String: frame]
USB URB
    [Source: 1.2.0]
    [Destination: host]
    USBPcap pseudoheader length: 28
    IRP ID: 0x0000000000000000
    IRP USBD_STATUS: USBD_STATUS_SUCCESS (0x00000000)
    URB Function: URB_FUNCTION_SELECT_CONFIGURATION (0x0000)
    IRP information: 0x01, Direction: PDO -> FDO
        0000 000. = Reserved: 0x00
        .... ...1 = Direction: PDO -> FDO (0x1)
    URB bus id: 1
    Device address: 2
    Endpoint: 0x00, Direction: OUT
        0... .... = Direction: OUT (0)
        .... 0000 = Endpoint number: 0
    URB transfer type: URB_CONTROL (0x02)
    Packet Data Length: 0
    [Request in: 17]
    [Time from request: 0.000000000 seconds]
    Control transfer stage: Complete (3)

No.     Time           Source                Destination           Protocol Length Info
     19 19.867485      host                  1.8.0                 USBHID   36     GET_REPORT Request

Frame 19: Packet, 36 bytes on wire (288 bits), 36 bytes captured (288 bits) on interface \\.\USBPcap1, id 0
    Section number: 1
    Interface id: 0 (\\.\USBPcap1)
        Interface name: \\.\USBPcap1
        Interface description: USBPcap1
    Encapsulation type: USB packets with USBPcap header (152)
    Arrival Time: Apr 23, 2026 22:32:28.536077000 Hora de verano de Cuba
    UTC Arrival Time: Apr 24, 2026 02:32:28.536077000 UTC
    Epoch Arrival Time: 1776997948.536077000
    [Time shift for this packet: 0.000000000 seconds]
    [Time delta from previous captured frame: 19.867485000 seconds]
    [Time delta from previous displayed frame: 19.867485000 seconds]
    [Time since reference or first frame: 19.867485000 seconds]
    Frame Number: 19
    Frame Length: 36 bytes (288 bits)
    Capture Length: 36 bytes (288 bits)
    [Frame is marked: False]
    [Frame is ignored: False]
    [Protocols in frame: usb:usbhid]
    Character encoding: ASCII (0)
    [Coloring Rule Name: Nueva regla de coloreado]
    [Coloring Rule String: frame]
USB URB
    [Source: host]
    [Destination: 1.8.0]
    USBPcap pseudoheader length: 28
    IRP ID: 0xffffe4039ebac270
    IRP USBD_STATUS: USBD_STATUS_SUCCESS (0x00000000)
    URB Function: URB_FUNCTION_CLASS_INTERFACE (0x001b)
    IRP information: 0x00, Direction: FDO -> PDO
        0000 000. = Reserved: 0x00
        .... ...0 = Direction: FDO -> PDO (0x0)
    URB bus id: 1
    Device address: 8
    Endpoint: 0x80, Direction: IN
        1... .... = Direction: IN (1)
        .... 0000 = Endpoint number: 0
    URB transfer type: URB_CONTROL (0x02)
    Packet Data Length: 8
    [Response in: 20]
    Control transfer stage: Setup (0)
    [bInterfaceClass: HID (0x03)]
Setup Data
    bmRequestType: 0xa1
        1... .... = Direction: Device-to-host
        .01. .... = Type: Class (0x1)
        ...0 0001 = Recipient: Interface (0x01)
    bRequest: GET_REPORT (0x01)
    wValue: 0x0300
        ReportID: 0
        ReportType: Feature (3)
    wIndex: 0
    wLength: 8

No.     Time           Source                Destination           Protocol Length Info
     20 19.867704      1.8.0                 host                  USBHID   36     GET_REPORT Response

Frame 20: Packet, 36 bytes on wire (288 bits), 36 bytes captured (288 bits) on interface \\.\USBPcap1, id 0
    Section number: 1
    Interface id: 0 (\\.\USBPcap1)
        Interface name: \\.\USBPcap1
        Interface description: USBPcap1
    Encapsulation type: USB packets with USBPcap header (152)
    Arrival Time: Apr 23, 2026 22:32:28.536296000 Hora de verano de Cuba
    UTC Arrival Time: Apr 24, 2026 02:32:28.536296000 UTC
    Epoch Arrival Time: 1776997948.536296000
    [Time shift for this packet: 0.000000000 seconds]
    [Time delta from previous captured frame: 219.000 microseconds]
    [Time delta from previous displayed frame: 219.000 microseconds]
    [Time since reference or first frame: 19.867704000 seconds]
    Frame Number: 20
    Frame Length: 36 bytes (288 bits)
    Capture Length: 36 bytes (288 bits)
    [Frame is marked: False]
    [Frame is ignored: False]
    [Protocols in frame: usb]
    Character encoding: ASCII (0)
    [Coloring Rule Name: Nueva regla de coloreado]
    [Coloring Rule String: frame]
USB URB
    [Source: 1.8.0]
    [Destination: host]
    USBPcap pseudoheader length: 28
    IRP ID: 0xffffe4039ebac270
    IRP USBD_STATUS: USBD_STATUS_SUCCESS (0x00000000)
    URB Function: URB_FUNCTION_CONTROL_TRANSFER (0x0008)
    IRP information: 0x01, Direction: PDO -> FDO
        0000 000. = Reserved: 0x00
        .... ...1 = Direction: PDO -> FDO (0x1)
    URB bus id: 1
    Device address: 8
    Endpoint: 0x80, Direction: IN
        1... .... = Direction: IN (1)
        .... 0000 = Endpoint number: 0
    URB transfer type: URB_CONTROL (0x02)
    Packet Data Length: 8
    [Request in: 19]
    [Time from request: 219.000 microseconds]
    Control transfer stage: Complete (3)
    [bInterfaceClass: HID (0x03)]

No.     Time           Source                Destination           Protocol Length Info
     21 19.880798      host                  1.8.0                 USBHID   44     SET_REPORT Request

Frame 21: Packet, 44 bytes on wire (352 bits), 44 bytes captured (352 bits) on interface \\.\USBPcap1, id 0
    Section number: 1
    Interface id: 0 (\\.\USBPcap1)
        Interface name: \\.\USBPcap1
        Interface description: USBPcap1
    Encapsulation type: USB packets with USBPcap header (152)
    Arrival Time: Apr 23, 2026 22:32:28.549390000 Hora de verano de Cuba
    UTC Arrival Time: Apr 24, 2026 02:32:28.549390000 UTC
    Epoch Arrival Time: 1776997948.549390000
    [Time shift for this packet: 0.000000000 seconds]
    [Time delta from previous captured frame: 13.094000 milliseconds]
    [Time delta from previous displayed frame: 13.094000 milliseconds]
    [Time since reference or first frame: 19.880798000 seconds]
    Frame Number: 21
    Frame Length: 44 bytes (352 bits)
    Capture Length: 44 bytes (352 bits)
    [Frame is marked: False]
    [Frame is ignored: False]
    [Protocols in frame: usb:usbhid]
    Character encoding: ASCII (0)
    [Coloring Rule Name: Nueva regla de coloreado]
    [Coloring Rule String: frame]
USB URB
    [Source: host]
    [Destination: 1.8.0]
    USBPcap pseudoheader length: 28
    IRP ID: 0xffffe403a4abd050
    IRP USBD_STATUS: USBD_STATUS_SUCCESS (0x00000000)
    URB Function: URB_FUNCTION_CLASS_INTERFACE (0x001b)
    IRP information: 0x00, Direction: FDO -> PDO
        0000 000. = Reserved: 0x00
        .... ...0 = Direction: FDO -> PDO (0x0)
    URB bus id: 1
    Device address: 8
    Endpoint: 0x00, Direction: OUT
        0... .... = Direction: OUT (0)
        .... 0000 = Endpoint number: 0
    URB transfer type: URB_CONTROL (0x02)
    Packet Data Length: 16
    [Response in: 22]
    Control transfer stage: Setup (0)
    [bInterfaceClass: HID (0x03)]
Setup Data
    bmRequestType: 0x21
        0... .... = Direction: Host-to-device
        .01. .... = Type: Class (0x1)
        ...0 0001 = Recipient: Interface (0x01)
    bRequest: SET_REPORT (0x09)
    wValue: 0x0300
        ReportID: 0
        ReportType: Feature (3)
    wIndex: 0
    wLength: 8
    Data Fragment: 0185000100ffff12

No.     Time           Source                Destination           Protocol Length Info
     22 19.881020      1.8.0                 host                  USBHID   28     SET_REPORT Response

Frame 22: Packet, 28 bytes on wire (224 bits), 28 bytes captured (224 bits) on interface \\.\USBPcap1, id 0
    Section number: 1
    Interface id: 0 (\\.\USBPcap1)
        Interface name: \\.\USBPcap1
        Interface description: USBPcap1
    Encapsulation type: USB packets with USBPcap header (152)
    Arrival Time: Apr 23, 2026 22:32:28.549612000 Hora de verano de Cuba
    UTC Arrival Time: Apr 24, 2026 02:32:28.549612000 UTC
    Epoch Arrival Time: 1776997948.549612000
    [Time shift for this packet: 0.000000000 seconds]
    [Time delta from previous captured frame: 222.000 microseconds]
    [Time delta from previous displayed frame: 222.000 microseconds]
    [Time since reference or first frame: 19.881020000 seconds]
    Frame Number: 22
    Frame Length: 28 bytes (224 bits)
    Capture Length: 28 bytes (224 bits)
    [Frame is marked: False]
    [Frame is ignored: False]
    [Protocols in frame: usb]
    Character encoding: ASCII (0)
    [Coloring Rule Name: Nueva regla de coloreado]
    [Coloring Rule String: frame]
USB URB
    [Source: 1.8.0]
    [Destination: host]
    USBPcap pseudoheader length: 28
    IRP ID: 0xffffe403a4abd050
    IRP USBD_STATUS: USBD_STATUS_SUCCESS (0x00000000)
    URB Function: URB_FUNCTION_CONTROL_TRANSFER (0x0008)
    IRP information: 0x01, Direction: PDO -> FDO
        0000 000. = Reserved: 0x00
        .... ...1 = Direction: PDO -> FDO (0x1)
    URB bus id: 1
    Device address: 8
    Endpoint: 0x00, Direction: OUT
        0... .... = Direction: OUT (0)
        .... 0000 = Endpoint number: 0
    URB transfer type: URB_CONTROL (0x02)
    Packet Data Length: 0
    [Request in: 21]
    [Time from request: 222.000 microseconds]
    Control transfer stage: Complete (3)
    [bInterfaceClass: HID (0x03)]

No.     Time           Source                Destination           Protocol Length Info
     23 19.911367      host                  1.8.0                 USBHID   36     GET_REPORT Request

Frame 23: Packet, 36 bytes on wire (288 bits), 36 bytes captured (288 bits) on interface \\.\USBPcap1, id 0
    Section number: 1
    Interface id: 0 (\\.\USBPcap1)
        Interface name: \\.\USBPcap1
        Interface description: USBPcap1
    Encapsulation type: USB packets with USBPcap header (152)
    Arrival Time: Apr 23, 2026 22:32:28.579959000 Hora de verano de Cuba
    UTC Arrival Time: Apr 24, 2026 02:32:28.579959000 UTC
    Epoch Arrival Time: 1776997948.579959000
    [Time shift for this packet: 0.000000000 seconds]
    [Time delta from previous captured frame: 30.347000 milliseconds]
    [Time delta from previous displayed frame: 30.347000 milliseconds]
    [Time since reference or first frame: 19.911367000 seconds]
    Frame Number: 23
    Frame Length: 36 bytes (288 bits)
    Capture Length: 36 bytes (288 bits)
    [Frame is marked: False]
    [Frame is ignored: False]
    [Protocols in frame: usb:usbhid]
    Character encoding: ASCII (0)
    [Coloring Rule Name: Nueva regla de coloreado]
    [Coloring Rule String: frame]
USB URB
    [Source: host]
    [Destination: 1.8.0]
    USBPcap pseudoheader length: 28
    IRP ID: 0xffffe403a6d37010
    IRP USBD_STATUS: USBD_STATUS_SUCCESS (0x00000000)
    URB Function: URB_FUNCTION_CLASS_INTERFACE (0x001b)
    IRP information: 0x00, Direction: FDO -> PDO
        0000 000. = Reserved: 0x00
        .... ...0 = Direction: FDO -> PDO (0x0)
    URB bus id: 1
    Device address: 8
    Endpoint: 0x80, Direction: IN
        1... .... = Direction: IN (1)
        .... 0000 = Endpoint number: 0
    URB transfer type: URB_CONTROL (0x02)
    Packet Data Length: 8
    [Response in: 24]
    Control transfer stage: Setup (0)
    [bInterfaceClass: HID (0x03)]
Setup Data
    bmRequestType: 0xa1
        1... .... = Direction: Device-to-host
        .01. .... = Type: Class (0x1)
        ...0 0001 = Recipient: Interface (0x01)
    bRequest: GET_REPORT (0x01)
    wValue: 0x0300
        ReportID: 0
        ReportType: Feature (3)
    wIndex: 0
    wLength: 8

No.     Time           Source                Destination           Protocol Length Info
     24 19.911619      1.8.0                 host                  USBHID   36     GET_REPORT Response

Frame 24: Packet, 36 bytes on wire (288 bits), 36 bytes captured (288 bits) on interface \\.\USBPcap1, id 0
    Section number: 1
    Interface id: 0 (\\.\USBPcap1)
        Interface name: \\.\USBPcap1
        Interface description: USBPcap1
    Encapsulation type: USB packets with USBPcap header (152)
    Arrival Time: Apr 23, 2026 22:32:28.580211000 Hora de verano de Cuba
    UTC Arrival Time: Apr 24, 2026 02:32:28.580211000 UTC
    Epoch Arrival Time: 1776997948.580211000
    [Time shift for this packet: 0.000000000 seconds]
    [Time delta from previous captured frame: 252.000 microseconds]
    [Time delta from previous displayed frame: 252.000 microseconds]
    [Time since reference or first frame: 19.911619000 seconds]
    Frame Number: 24
    Frame Length: 36 bytes (288 bits)
    Capture Length: 36 bytes (288 bits)
    [Frame is marked: False]
    [Frame is ignored: False]
    [Protocols in frame: usb]
    Character encoding: ASCII (0)
    [Coloring Rule Name: Nueva regla de coloreado]
    [Coloring Rule String: frame]
USB URB
    [Source: 1.8.0]
    [Destination: host]
    USBPcap pseudoheader length: 28
    IRP ID: 0xffffe403a6d37010
    IRP USBD_STATUS: USBD_STATUS_SUCCESS (0x00000000)
    URB Function: URB_FUNCTION_CONTROL_TRANSFER (0x0008)
    IRP information: 0x01, Direction: PDO -> FDO
        0000 000. = Reserved: 0x00
        .... ...1 = Direction: PDO -> FDO (0x1)
    URB bus id: 1
    Device address: 8
    Endpoint: 0x80, Direction: IN
        1... .... = Direction: IN (1)
        .... 0000 = Endpoint number: 0
    URB transfer type: URB_CONTROL (0x02)
    Packet Data Length: 8
    [Request in: 23]
    [Time from request: 252.000 microseconds]
    Control transfer stage: Complete (3)
    [bInterfaceClass: HID (0x03)]
